{
  "schema_version": "1.0",
  "kind": "career-interview-session",
  "session_id": "SESSION-SYNTH-001",
  "revision": 1,
  "created_at": "2026-10-23T00:00:00Z",
  "mode": "coaching",
  "status": "paused",
  "materials": [
    {
      "id": "JD-SYNTH",
      "kind": "jd",
      "label": "합성 운영 엔지니어 JD v1",
      "text": "배포 절차 개선과 협업 경험을 설명할 수 있어야 합니다."
    },
    {
      "id": "CAREER-SYNTH",
      "kind": "user_statement",
      "label": "합성 사용자 진술 v1",
      "text": "저는 배포 체크리스트 초안을 작성했습니다. 배포 실행은 동료가 했고 개선 시간은 측정하지 않았습니다."
    }
  ],
  "constraints": [
    "배포 실행은 동료의 기여다.",
    "개선 시간과 비공개 수치를 만들어 쓰지 않는다."
  ],
  "material_digest": "c7ec476f8d9d808953b10ab0c69c2731e58bf33feab2d8b2a892a6d74745fec0",
  "turns": [
    {
      "id": "Q1",
      "question": "체크리스트 초안을 작성한 본인의 행동과 동료의 역할을 설명해 주세요.",
      "material_ids": [
        "JD-SYNTH",
        "CAREER-SYNTH"
      ],
      "gap": false,
      "answers": [
        {
          "revision": 1,
          "text": "저는 체크리스트 초안을 작성했고 배포는 동료가 했습니다. 개선 시간은 측정하지 않았습니다. 초안은 팀의 피드백을 받아 고쳤습니다.",
          "input_mode": "text",
          "confirmed": true
        }
      ],
      "feedback": [
        {
          "answer_revision": 1,
          "text": "본인 행동과 동료의 기여를 구분했습니다. 수정한 항목의 예를 설명해 보세요."
        }
      ],
      "candidates": [
        {
          "id": "C1",
          "answer_revision": 1,
          "text": "초안을 팀 피드백으로 수정했다는 진술: 별도 사실·사용 검토 필요.",
          "status": "pending"
        }
      ]
    },
    {
      "id": "Q2",
      "question": "체크리스트에서 실제로 수정했던 항목 하나를 설명해 주세요.",
      "material_ids": [
        "CAREER-SYNTH"
      ],
      "gap": false,
      "answers": [],
      "feedback": [],
      "candidates": []
    }
  ],
  "next_step": "Q2에 답변하거나 Q1을 수정한다. 새 후보 C1은 career-review에서 별도 확인한다."
}
